{
  "schemaVersion": 2,
  "taskId": "3d32e670-dca3-4b93-8cbe-9772472f6610",
  "revision": 0,
  "demo": true,
  "evaluationDate": "2026-06-15",
  "request": {
    "destinationId": "sim-cloudwater",
    "destination": "云水古城（虚构实训目的地）",
    "startDate": "2026-07-18",
    "days": 2,
    "adults": 2,
    "children": 1,
    "seniors": 1,
    "budget": 3000,
    "maxWalkingMinutes": 70,
    "weather": "clear",
    "avoidOutdoorInRain": true,
    "interests": [
      "非遗",
      "亲子"
    ],
    "dietary": "清淡且不含花生",
    "accessibility": "长者不适合长时间步行",
    "dayWindows": [
      {
        "day": 1,
        "start": "09:00",
        "end": "21:30",
        "minActivities": 2,
        "requiredMeals": [
          "lunch"
        ]
      },
      {
        "day": 2,
        "start": "09:00",
        "end": "17:00",
        "minActivities": 1,
        "requiredMeals": [
          "lunch"
        ]
      }
    ],
    "requiredNights": [
      1
    ],
    "selfArrangedNights": [],
    "dietaryRequirements": {
      "excludedAllergens": [
        "花生"
      ],
      "avoidCrossContact": true,
      "dietTypes": [
        "清淡"
      ]
    },
    "accessibilityRequirements": {
      "wheelchairRoute": false,
      "stepFree": false,
      "accessibleRoom": false,
      "accessibleVehicle": false
    },
    "unresolvedRequirements": []
  },
  "resources": [
    {
      "destinationId": "sim-cloudwater",
      "areaId": "east",
      "durationMinutes": 120,
      "openStart": "09:00",
      "openEnd": "17:00",
      "indoor": true,
      "tags": [
        "非遗",
        "亲子"
      ],
      "adultPrice": 120,
      "childPrice": 60,
      "seniorPrice": 60,
      "unitPrice": null,
      "capacityPerSlot": 30,
      "capacityPerRoom": null,
      "accessibleRoomsAvailable": null,
      "allergenFree": {},
      "crossContactControlled": {},
      "dietSupport": {},
      "accessibility": {
        "wheelchairRoute": "yes",
        "stepFree": "yes",
        "accessibleRoom": "unknown",
        "accessibleVehicle": "unknown"
      },
      "pricingEvidenceIds": [
        "SIM-F01"
      ],
      "openingEvidenceIds": [
        "SIM-F01"
      ],
      "capacityEvidenceIds": [
        "SIM-F01"
      ],
      "suitabilityEvidenceIds": [
        "SIM-F01"
      ],
      "id": "heritage",
      "name": "云水非遗工坊",
      "type": "activity",
      "location": "古城东区",
      "priceMode": "ticket"
    },
    {
      "destinationId": "sim-cloudwater",
      "areaId": "south",
      "durationMinutes": 120,
      "openStart": "08:00",
      "openEnd": "18:00",
      "indoor": false,
      "tags": [
        "自然",
        "摄影"
      ],
      "adultPrice": 80,
      "childPrice": 40,
      "seniorPrice": 40,
      "unitPrice": null,
      "capacityPerSlot": 100,
      "capacityPerRoom": null,
      "accessibleRoomsAvailable": null,
      "allergenFree": {},
      "crossContactControlled": {},
      "dietSupport": {},
      "accessibility": {
        "wheelchairRoute": "yes",
        "stepFree": "yes",
        "accessibleRoom": "unknown",
        "accessibleVehicle": "unknown"
      },
      "pricingEvidenceIds": [
        "SIM-F02"
      ],
      "openingEvidenceIds": [
        "SIM-F02"
      ],
      "capacityEvidenceIds": [
        "SIM-F02"
      ],
      "suitabilityEvidenceIds": [
        "SIM-F02"
      ],
      "id": "garden",
      "name": "青岚湿地花园",
      "type": "activity",
      "location": "古城南区",
      "priceMode": "ticket"
    },
    {
      "destinationId": "sim-cloudwater",
      "areaId": "center",
      "durationMinutes": 120,
      "openStart": "09:00",
      "openEnd": "17:00",
      "indoor": true,
      "tags": [
        "文化",
        "亲子"
      ],
      "adultPrice": 60,
      "childPrice": 30,
      "seniorPrice": 0,
      "unitPrice": null,
      "capacityPerSlot": 60,
      "capacityPerRoom": null,
      "accessibleRoomsAvailable": null,
      "allergenFree": {},
      "crossContactControlled": {},
      "dietSupport": {},
      "accessibility": {
        "wheelchairRoute": "yes",
        "stepFree": "yes",
        "accessibleRoom": "unknown",
        "accessibleVehicle": "unknown"
      },
      "pricingEvidenceIds": [
        "SIM-F03"
      ],
      "openingEvidenceIds": [
        "SIM-F03"
      ],
      "capacityEvidenceIds": [
        "SIM-F03"
      ],
      "suitabilityEvidenceIds": [
        "SIM-F03"
      ],
      "id": "museum",
      "name": "城史互动馆",
      "type": "activity",
      "location": "古城中心",
      "priceMode": "ticket"
    },
    {
      "destinationId": "sim-cloudwater",
      "areaId": "center",
      "durationMinutes": 150,
      "openStart": "10:00",
      "openEnd": "20:00",
      "indoor": true,
      "tags": [
        "非遗",
        "数字媒体",
        "亲子"
      ],
      "adultPrice": null,
      "childPrice": null,
      "seniorPrice": null,
      "unitPrice": 130,
      "capacityPerSlot": 20,
      "capacityPerRoom": null,
      "accessibleRoomsAvailable": null,
      "allergenFree": {},
      "crossContactControlled": {},
      "dietSupport": {},
      "accessibility": {
        "wheelchairRoute": "yes",
        "stepFree": "yes",
        "accessibleRoom": "unknown",
        "accessibleVehicle": "unknown"
      },
      "pricingEvidenceIds": [
        "SIM-F04"
      ],
      "openingEvidenceIds": [
        "SIM-F04"
      ],
      "capacityEvidenceIds": [
        "SIM-F04"
      ],
      "suitabilityEvidenceIds": [
        "SIM-F04"
      ],
      "id": "craft",
      "name": "数字宋韵创作室",
      "type": "activity",
      "location": "古城中心",
      "priceMode": "per_person"
    },
    {
      "destinationId": "sim-cloudwater",
      "areaId": "east",
      "durationMinutes": 30,
      "openStart": "14:00",
      "openEnd": "23:00",
      "indoor": true,
      "tags": [
        "文化"
      ],
      "adultPrice": null,
      "childPrice": null,
      "seniorPrice": null,
      "unitPrice": 450,
      "capacityPerSlot": null,
      "capacityPerRoom": 2,
      "accessibleRoomsAvailable": 0,
      "allergenFree": {},
      "crossContactControlled": {},
      "dietSupport": {},
      "accessibility": {
        "wheelchairRoute": "yes",
        "stepFree": "yes",
        "accessibleRoom": "no",
        "accessibleVehicle": "unknown"
      },
      "pricingEvidenceIds": [
        "SIM-F05"
      ],
      "openingEvidenceIds": [
        "SIM-F05"
      ],
      "capacityEvidenceIds": [
        "SIM-F05"
      ],
      "suitabilityEvidenceIds": [
        "SIM-F05"
      ],
      "id": "inn",
      "name": "栖水文化客栈·双床房",
      "type": "stay",
      "location": "古城东区",
      "priceMode": "per_room_night"
    },
    {
      "destinationId": "sim-cloudwater",
      "areaId": "center",
      "durationMinutes": 30,
      "openStart": "14:00",
      "openEnd": "23:00",
      "indoor": true,
      "tags": [
        "亲子"
      ],
      "adultPrice": null,
      "childPrice": null,
      "seniorPrice": null,
      "unitPrice": 720,
      "capacityPerSlot": null,
      "capacityPerRoom": 4,
      "accessibleRoomsAvailable": 2,
      "allergenFree": {},
      "crossContactControlled": {},
      "dietSupport": {},
      "accessibility": {
        "wheelchairRoute": "yes",
        "stepFree": "yes",
        "accessibleRoom": "yes",
        "accessibleVehicle": "unknown"
      },
      "pricingEvidenceIds": [
        "SIM-F06"
      ],
      "openingEvidenceIds": [
        "SIM-F06"
      ],
      "capacityEvidenceIds": [
        "SIM-F06"
      ],
      "suitabilityEvidenceIds": [
        "SIM-F06"
      ],
      "id": "hotel",
      "name": "晴川亲子酒店·家庭房",
      "type": "stay",
      "location": "古城中心",
      "priceMode": "per_room_night"
    },
    {
      "destinationId": "sim-cloudwater",
      "areaId": "east",
      "durationMinutes": 90,
      "openStart": "11:00",
      "openEnd": "20:30",
      "indoor": true,
      "tags": [
        "地方餐饮"
      ],
      "adultPrice": null,
      "childPrice": null,
      "seniorPrice": null,
      "unitPrice": 60,
      "capacityPerSlot": 50,
      "capacityPerRoom": null,
      "accessibleRoomsAvailable": null,
      "allergenFree": {
        "花生": "yes"
      },
      "crossContactControlled": {
        "花生": "yes"
      },
      "dietSupport": {
        "清淡": "yes"
      },
      "accessibility": {
        "wheelchairRoute": "yes",
        "stepFree": "yes",
        "accessibleRoom": "unknown",
        "accessibleVehicle": "unknown"
      },
      "pricingEvidenceIds": [
        "SIM-F07"
      ],
      "openingEvidenceIds": [
        "SIM-F07"
      ],
      "capacityEvidenceIds": [
        "SIM-F07"
      ],
      "suitabilityEvidenceIds": [
        "SIM-F07"
      ],
      "id": "localmeal",
      "name": "水乡家宴",
      "type": "meal",
      "location": "古城东区",
      "priceMode": "per_person"
    },
    {
      "destinationId": "sim-cloudwater",
      "areaId": "center",
      "durationMinutes": 90,
      "openStart": "11:00",
      "openEnd": "21:00",
      "indoor": true,
      "tags": [
        "亲子"
      ],
      "adultPrice": null,
      "childPrice": null,
      "seniorPrice": null,
      "unitPrice": 75,
      "capacityPerSlot": 80,
      "capacityPerRoom": null,
      "accessibleRoomsAvailable": null,
      "allergenFree": {
        "花生": "yes"
      },
      "crossContactControlled": {
        "花生": "yes"
      },
      "dietSupport": {
        "清淡": "yes"
      },
      "accessibility": {
        "wheelchairRoute": "yes",
        "stepFree": "yes",
        "accessibleRoom": "unknown",
        "accessibleVehicle": "unknown"
      },
      "pricingEvidenceIds": [
        "SIM-F08"
      ],
      "openingEvidenceIds": [
        "SIM-F08"
      ],
      "capacityEvidenceIds": [
        "SIM-F08"
      ],
      "suitabilityEvidenceIds": [
        "SIM-F08"
      ],
      "id": "familymeal",
      "name": "亲子融合餐厅",
      "type": "meal",
      "location": "古城中心",
      "priceMode": "per_person"
    },
    {
      "destinationId": "sim-cloudwater",
      "areaId": "west",